[
  {
    "id": "concept-linear-algebra",
    "type": "concept",
    "label": "Linear Algebra",
    "description": "Vectors, matrices, eigenvalues, and linear transformations — the mathematical substrate of neural networks and AI.",
    "domain": "domain-ai-architect",
    "tags": [
      "mathematics",
      "ai-foundation",
      "vectors",
      "matrices"
    ],
    "status": "stable",
    "created_at": "2025-01-01T00:00:00Z",
    "updated_at": "2025-01-01T00:00:00Z",
    "edges": [
      {
        "type": "unlocks",
        "target": "concept-gradient-descent"
      },
      {
        "type": "unlocks",
        "target": "concept-attention-mechanism"
      }
    ]
  },
  {
    "id": "concept-probability-statistics",
    "type": "concept",
    "label": "Probability and Statistics",
    "description": "Distributions, inference, Bayes' theorem, and statistical reasoning — required for understanding model training and evaluation.",
    "domain": "domain-ai-architect",
    "tags": [
      "mathematics",
      "statistics",
      "probability",
      "ai-foundation"
    ],
    "status": "stable",
    "created_at": "2025-01-01T00:00:00Z",
    "updated_at": "2025-01-01T00:00:00Z",
    "edges": [
      {
        "type": "unlocks",
        "target": "concept-gradient-descent"
      },
      {
        "type": "unlocks",
        "target": "concept-pretraining-objectives"
      }
    ]
  },
  {
    "id": "concept-calculus-optimization",
    "type": "concept",
    "label": "Calculus and Optimization",
    "description": "Derivatives, gradients, chain rule, and optimization landscapes — the foundation of learning algorithms.",
    "domain": "domain-ai-architect",
    "tags": [
      "mathematics",
      "calculus",
      "optimization",
      "ai-foundation"
    ],
    "status": "stable",
    "created_at": "2025-01-01T00:00:00Z",
    "updated_at": "2025-01-01T00:00:00Z",
    "edges": [
      {
        "type": "unlocks",
        "target": "concept-gradient-descent"
      },
      {
        "type": "unlocks",
        "target": "concept-backpropagation"
      }
    ]
  },
  {
    "id": "concept-gradient-descent",
    "type": "concept",
    "label": "Gradient Descent",
    "description": "Iterative optimization via first-order gradients. The core learning algorithm behind neural networks.",
    "domain": "domain-ai-architect",
    "tags": [
      "optimization",
      "training",
      "deep-learning"
    ],
    "status": "stable",
    "created_at": "2025-01-01T00:00:00Z",
    "updated_at": "2025-01-01T00:00:00Z",
    "edges": [
      {
        "type": "requires",
        "target": "concept-calculus-optimization"
      },
      {
        "type": "unlocks",
        "target": "concept-backpropagation"
      },
      {
        "type": "unlocks",
        "target": "skill-train-basic-nn"
      }
    ]
  },
  {
    "id": "concept-backpropagation",
    "type": "concept",
    "label": "Backpropagation",
    "description": "Efficient computation of gradients through a neural network using the chain rule. Required to understand how networks learn.",
    "domain": "domain-ai-architect",
    "tags": [
      "training",
      "deep-learning",
      "gradients"
    ],
    "status": "stable",
    "created_at": "2025-01-01T00:00:00Z",
    "updated_at": "2025-01-01T00:00:00Z",
    "edges": [
      {
        "type": "requires",
        "target": "concept-gradient-descent"
      },
      {
        "type": "unlocks",
        "target": "concept-neural-network-basics"
      }
    ]
  },
  {
    "id": "concept-neural-network-basics",
    "type": "concept",
    "label": "Neural Network Basics",
    "description": "Layers, activations, loss functions, and forward/backward passes in a feedforward network.",
    "domain": "domain-ai-architect",
    "tags": [
      "deep-learning",
      "neural-networks",
      "architecture"
    ],
    "status": "stable",
    "created_at": "2025-01-01T00:00:00Z",
    "updated_at": "2025-01-01T00:00:00Z",
    "edges": [
      {
        "type": "requires",
        "target": "concept-backpropagation"
      },
      {
        "type": "unlocks",
        "target": "concept-sequence-modeling"
      }
    ]
  },
  {
    "id": "concept-sequence-modeling",
    "type": "concept",
    "label": "Sequence Modeling",
    "description": "Modeling ordered data — text, time series, code. From RNNs and LSTMs through the transformer revolution.",
    "domain": "domain-ai-architect",
    "tags": [
      "nlp",
      "sequences",
      "rnn",
      "lstm",
      "transformers"
    ],
    "status": "stable",
    "created_at": "2025-01-01T00:00:00Z",
    "updated_at": "2025-01-01T00:00:00Z",
    "edges": [
      {
        "type": "requires",
        "target": "concept-neural-network-basics"
      },
      {
        "type": "unlocks",
        "target": "concept-attention-mechanism"
      }
    ]
  },
  {
    "id": "concept-attention-mechanism",
    "type": "concept",
    "label": "Attention Mechanism",
    "description": "Scaled dot-product attention: how a model learns to weigh different positions in a sequence when producing each output.",
    "domain": "domain-ai-architect",
    "tags": [
      "transformers",
      "attention",
      "deep-learning",
      "nlp"
    ],
    "status": "stable",
    "created_at": "2025-01-01T00:00:00Z",
    "updated_at": "2025-01-01T00:00:00Z",
    "edges": [
      {
        "type": "requires",
        "target": "concept-linear-algebra"
      },
      {
        "type": "requires",
        "target": "concept-sequence-modeling"
      },
      {
        "type": "unlocks",
        "target": "concept-transformer-architecture"
      },
      {
        "type": "evidenced_by",
        "target": "paper-attention-is-all-you-need"
      }
    ]
  },
  {
    "id": "concept-transformer-architecture",
    "type": "concept",
    "label": "Transformer Architecture",
    "description": "The encoder-decoder architecture based on multi-head self-attention. The dominant paradigm for language, vision, and multimodal models.",
    "domain": "domain-ai-architect",
    "tags": [
      "transformers",
      "architecture",
      "nlp",
      "foundation-models"
    ],
    "status": "stable",
    "created_at": "2025-01-01T00:00:00Z",
    "updated_at": "2025-01-01T00:00:00Z",
    "edges": [
      {
        "type": "requires",
        "target": "concept-attention-mechanism"
      },
      {
        "type": "unlocks",
        "target": "concept-pretraining-objectives"
      },
      {
        "type": "unlocks",
        "target": "skill-implement-transformer"
      },
      {
        "type": "evidenced_by",
        "target": "paper-attention-is-all-you-need"
      }
    ]
  },
  {
    "id": "concept-pretraining-objectives",
    "type": "concept",
    "label": "Pretraining Objectives",
    "description": "Self-supervised objectives for training language models: next-token prediction, masked language modeling, contrastive learning.",
    "domain": "domain-ai-architect",
    "tags": [
      "pretraining",
      "self-supervised",
      "llm",
      "training"
    ],
    "status": "stable",
    "created_at": "2025-01-01T00:00:00Z",
    "updated_at": "2025-01-01T00:00:00Z",
    "edges": [
      {
        "type": "requires",
        "target": "concept-transformer-architecture"
      },
      {
        "type": "requires",
        "target": "concept-probability-statistics"
      },
      {
        "type": "unlocks",
        "target": "skill-finetune-llm"
      }
    ]
  },
  {
    "id": "concept-rlhf",
    "type": "concept",
    "label": "Reinforcement Learning from Human Feedback (RLHF)",
    "description": "The process of aligning a language model to human preferences using a reward model trained on human comparisons.",
    "domain": "domain-ai-architect",
    "tags": [
      "alignment",
      "rlhf",
      "fine-tuning",
      "llm"
    ],
    "status": "stable",
    "created_at": "2025-01-01T00:00:00Z",
    "updated_at": "2025-01-01T00:00:00Z",
    "edges": [
      {
        "type": "requires",
        "target": "concept-pretraining-objectives"
      },
      {
        "type": "unlocks",
        "target": "skill-evaluate-alignment"
      },
      {
        "type": "unlocks",
        "target": "concept-constitutional-ai"
      }
    ]
  },
  {
    "id": "concept-constitutional-ai",
    "type": "concept",
    "label": "Constitutional AI",
    "description": "Anthropic's technique for training AI systems to be helpful, harmless, and honest using a set of principles (a 'constitution') without solely relying on human feedback.",
    "domain": "domain-ai-architect",
    "tags": [
      "alignment",
      "constitutional-ai",
      "anthropic",
      "safety"
    ],
    "status": "stable",
    "created_at": "2025-01-01T00:00:00Z",
    "updated_at": "2025-01-01T00:00:00Z",
    "edges": [
      {
        "type": "requires",
        "target": "concept-rlhf"
      },
      {
        "type": "unlocks",
        "target": "concept-interpretability"
      }
    ]
  },
  {
    "id": "concept-interpretability",
    "type": "concept",
    "label": "Interpretability",
    "description": "Methods for understanding what a neural network has learned — from saliency maps to circuit analysis.",
    "domain": "domain-ai-architect",
    "tags": [
      "interpretability",
      "safety",
      "alignment",
      "xai"
    ],
    "status": "stable",
    "created_at": "2025-01-01T00:00:00Z",
    "updated_at": "2025-01-01T00:00:00Z",
    "edges": [
      {
        "type": "unlocks",
        "target": "concept-mechanistic-interpretability"
      }
    ]
  },
  {
    "id": "concept-mechanistic-interpretability",
    "type": "concept",
    "label": "Mechanistic Interpretability",
    "description": "Reverse-engineering neural networks at the level of circuits and features to understand how specific computations are implemented.",
    "domain": "domain-ai-architect",
    "tags": [
      "interpretability",
      "circuits",
      "features",
      "alignment",